{
  "$schema": "./features.schema.json",
  "schemaVersion": "1.0.0",
  "defaultLocale": "ja",
  "categories": [
    {
      "id": "portal",
      "displayName": {
        "ja": "ポータル",
        "en": "Portal"
      }
    },
    {
      "id": "facility",
      "displayName": {
        "ja": "施設",
        "en": "Facility"
      }
    },
    {
      "id": "place",
      "displayName": {
        "ja": "場所",
        "en": "Place"
      }
    }
  ],
  "features": [
    {
      "id": "portal.nether",
      "displayName": {
        "ja": "ネザーポータル",
        "en": "Nether portal"
      },
      "category": "portal",
      "appliesTo": ["node"],
      "match": {
        "tags": {
          "portal": "nether"
        }
      },
      "editor": {
        "create": {
          "kind": "node",
          "tags": {
            "portal": "nether"
          }
        },
        "snapPolicy": "half",
        "fields": [
          {
            "type": "text",
            "tag": "name",
            "label": {
              "ja": "名前",
              "en": "Name"
            }
          }
        ]
      },
      "viewer": {
        "minZoom": 4,
        "icon": "nether-portal",
        "label": {
          "tag": "name",
          "minZoom": 6,
          "collisionPriority": 80
        }
      }
    },
    {
      "id": "facility.automatic_storage",
      "displayName": {
        "ja": "自動倉庫",
        "en": "Automatic storage"
      },
      "category": "facility",
      "appliesTo": ["node", "area"],
      "match": {
        "tags": {
          "facility": "storage",
          "automation": "redstone"
        }
      },
      "editor": {
        "create": {
          "kind": "node",
          "tags": {
            "facility": "storage",
            "automation": "redstone"
          }
        },
        "snapPolicy": "half",
        "fields": [
          {
            "type": "text",
            "tag": "name",
            "label": {
              "ja": "名前",
              "en": "Name"
            }
          }
        ]
      },
      "viewer": {
        "minZoom": 5,
        "icon": "automatic-storage",
        "label": {
          "tag": "name",
          "minZoom": 7,
          "collisionPriority": 60
        }
      }
    },
    {
      "id": "facility.storage",
      "displayName": {
        "ja": "倉庫",
        "en": "Storage"
      },
      "category": "facility",
      "appliesTo": ["node", "area"],
      "match": {
        "tags": {
          "facility": "storage"
        }
      },
      "editor": {
        "create": {
          "kind": "node",
          "tags": {
            "facility": "storage"
          }
        },
        "snapPolicy": "half",
        "fields": [
          {
            "type": "text",
            "tag": "name",
            "label": {
              "ja": "名前",
              "en": "Name"
            }
          }
        ]
      },
      "viewer": {
        "minZoom": 6,
        "icon": "chest",
        "label": {
          "tag": "name",
          "minZoom": 8,
          "collisionPriority": 40
        }
      }
    },
    {
      "id": "facility.farm",
      "displayName": {
        "ja": "畑",
        "en": "Farm"
      },
      "category": "facility",
      "appliesTo": ["node", "area"],
      "match": {
        "tags": {
          "facility": "farm"
        }
      },
      "editor": {
        "create": {
          "kind": "area",
          "tags": {
            "facility": "farm"
          }
        },
        "snapPolicy": "half",
        "fields": [
          {
            "type": "text",
            "tag": "name",
            "label": {
              "ja": "名前",
              "en": "Name"
            }
          },
          {
            "type": "select",
            "tag": "crop",
            "label": {
              "ja": "作物",
              "en": "Crop"
            },
            "allowUnset": true,
            "options": [
              {
                "value": "wheat",
                "label": {
                  "ja": "小麦",
                  "en": "Wheat"
                }
              },
              {
                "value": "carrot",
                "label": {
                  "ja": "ニンジン",
                  "en": "Carrot"
                }
              },
              {
                "value": "potato",
                "label": {
                  "ja": "ジャガイモ",
                  "en": "Potato"
                }
              },
              {
                "value": "beetroot",
                "label": {
                  "ja": "ビートルート",
                  "en": "Beetroot"
                }
              },
              {
                "value": "pumpkin",
                "label": {
                  "ja": "カボチャ",
                  "en": "Pumpkin"
                }
              },
              {
                "value": "melon",
                "label": {
                  "ja": "スイカ",
                  "en": "Melon"
                }
              },
              {
                "value": "sugar_cane",
                "label": {
                  "ja": "サトウキビ",
                  "en": "Sugar cane"
                }
              },
              {
                "value": "cactus",
                "label": {
                  "ja": "サボテン",
                  "en": "Cactus"
                }
              },
              {
                "value": "mixed",
                "label": {
                  "ja": "混合",
                  "en": "Mixed"
                }
              },
              {
                "value": "other",
                "label": {
                  "ja": "その他",
                  "en": "Other"
                }
              }
            ]
          }
        ]
      },
      "viewer": {
        "minZoom": 2,
        "icon": "farm",
        "label": {
          "tag": "name",
          "minZoom": 7,
          "collisionPriority": 50
        }
      }
    },
    {
      "id": "facility.tree_farm",
      "displayName": {
        "ja": "植林場",
        "en": "Tree farm"
      },
      "category": "facility",
      "appliesTo": ["node", "area"],
      "match": {
        "tags": {
          "facility": "tree_farm"
        }
      },
      "editor": {
        "create": {
          "kind": "area",
          "tags": {
            "facility": "tree_farm"
          }
        },
        "snapPolicy": "half",
        "fields": [
          {
            "type": "text",
            "tag": "name",
            "label": {
              "ja": "名前",
              "en": "Name"
            }
          },
          {
            "type": "select",
            "tag": "tree",
            "label": {
              "ja": "樹種",
              "en": "Tree"
            },
            "allowUnset": true,
            "options": [
              {
                "value": "oak",
                "label": {
                  "ja": "オーク",
                  "en": "Oak"
                }
              },
              {
                "value": "spruce",
                "label": {
                  "ja": "トウヒ",
                  "en": "Spruce"
                }
              },
              {
                "value": "birch",
                "label": {
                  "ja": "シラカバ",
                  "en": "Birch"
                }
              },
              {
                "value": "jungle",
                "label": {
                  "ja": "ジャングル",
                  "en": "Jungle"
                }
              },
              {
                "value": "acacia",
                "label": {
                  "ja": "アカシア",
                  "en": "Acacia"
                }
              },
              {
                "value": "dark_oak",
                "label": {
                  "ja": "ダークオーク",
                  "en": "Dark oak"
                }
              },
              {
                "value": "mangrove",
                "label": {
                  "ja": "マングローブ",
                  "en": "Mangrove"
                }
              },
              {
                "value": "cherry",
                "label": {
                  "ja": "サクラ",
                  "en": "Cherry"
                }
              },
              {
                "value": "mixed",
                "label": {
                  "ja": "混合",
                  "en": "Mixed"
                }
              },
              {
                "value": "other",
                "label": {
                  "ja": "その他",
                  "en": "Other"
                }
              }
            ]
          }
        ]
      },
      "viewer": {
        "minZoom": 5,
        "icon": "tree-farm",
        "label": {
          "tag": "name",
          "minZoom": 7,
          "collisionPriority": 50
        }
      }
    },
    {
      "id": "place.base",
      "displayName": {
        "ja": "拠点",
        "en": "Base"
      },
      "category": "place",
      "appliesTo": ["node", "area"],
      "match": {
        "tags": {
          "place": "base"
        }
      },
      "editor": {
        "create": {
          "kind": "node",
          "tags": {
            "place": "base"
          }
        },
        "snapPolicy": "half",
        "fields": [
          {
            "type": "text",
            "tag": "name",
            "label": {
              "ja": "名前",
              "en": "Name"
            }
          }
        ]
      },
      "viewer": {
        "minZoom": 2,
        "icon": "base",
        "label": {
          "tag": "name",
          "minZoom": 3,
          "collisionPriority": 100
        }
      }
    }
  ]
}
